{
  "schema": "vaultsovereign.codex.task_bundle.v1",
  "task_id": "codex_task_rfc_editor_lookup_demo_v1",
  "target_repo": {
    "name": "witnessops-node/codex",
    "path": "/home/ops/witnessops-node/codex",
    "remote": null,
    "expected_root_markers": [
      "bin/codex-seed"
    ]
  },
  "prompt": {
    "instruction": "Bounded public demo lookup: inspect RFC Editor pages for April Fools RFCs only. Report official titles and one-sentence summaries. Pick the funniest official-looking standard from the allowlisted set.",
    "context": "Allowlisted sources only:\n- https://www.rfc-editor.org/info/rfc2324\n- https://www.rfc-editor.org/info/rfc1149\n- https://www.rfc-editor.org/info/rfc2549\n\nForbidden: social media, login, forms, downloads, purchases, arbitrary domains, repo file mutation.\n\nDeterministic candidates:\n- RFC 2324 \u2014 Hyper Text Coffee Pot Control Protocol (418 I'm a teapot)\n- RFC 1149 \u2014 IP Datagrams on Avian Carriers\n- RFC 2549 \u2014 IP over Avian Carriers with QoS\n\nOutput JSON: { \"winner_rfc\": \"2324|1149|2549\", \"title\": \"...\", \"one_line\": \"...\", \"source_urls\": [\"...\"], \"boundary\": \"cited RFC Editor pages only\" }"
  },
  "execution": {
    "mode": "codex_exec",
    "sandbox": "read-only",
    "ask_for_approval": "never",
    "json": true,
    "ephemeral": true,
    "web_search": true,
    "model": null,
    "profile": null,
    "timeout_seconds": 300
  },
  "policy": {
    "allow_web_search": true,
    "allow_danger_full_access": false,
    "intended_effect": "humorous_public_lookup"
  },
  "operator_approval": {
    "approved_by": "sovereign",
    "approved_at": "2026-07-07T02:30:00Z",
    "intent_hash": "sha256:11c129ff4ed53c8ce202823986a534b21a3a6d60c66a1276e382d006dc5c1faf"
  }
}
